{
  "rosterChangeType": "R",
  "rosterChangeTypeDesc": "RDO",  
  "dateAppliedForLabel": "RDO",
  "volunteerShiftVisible": true,
  "volunteerShiftRequired": true,
  "nextNightShiftVisible": true,
  "nextNightShiftRequired": true,
  "offDayVisible": true,
  "offDayRequired": true,
  "workDay": "Off â€“ Rostered Week Off",
  "daysTakenVisible": true,
  "daysTaken": 14,
  "daysLabel": "RDO",
  "volunteerShiftDetails": {
    "volunteerShift": "L_DAY",
    "volunteerShiftDescr": "Day"    
  }
} 